id,conversation_id,created_at,date,time,timezone,user_id,username,name,place,tweet,language,mentions,urls,photos,replies_count,retweets_count,likes_count,hashtags,cashtags,link,retweet,quote_url,video,thumbnail,near,geo,source,user_rt_id,user_rt,retweet_id,reply_to,retweet_date,translate,trans_src,trans_dest
1386447427373174786,1386447427373174786,2021-04-26 04:15:00 +0545,2021-04-26,04:15:00,+0545,625760052,kathmandupost,The Kathmandu Post,,"Chinese border closure hits Nepali entrepreneurs hard  With no export orders, manufacturers and exporters are facing tough times and have started looking for other sources of income observing the situation.  https://t.co/8RHY6nmoHo — by @PrasainKrishana",en,"[{'screen_name': 'prasainkrishana', 'name': 'krishana prasain', 'id': '2236195390'}]",['https://tkpo.st/3eqOudn'],[],0,2,7,[],[],https://twitter.com/kathmandupost/status/1386447427373174786,False,,0,,,,,,,,[],,,,
1386421003006332929,1386421003006332929,2021-04-26 02:30:00 +0545,2021-04-26,02:30:00,+0545,625760052,kathmandupost,The Kathmandu Post,,"Citing violation of the Public Procurement Act, the committee had ordered scrapping of the bidding process for construction o tunnels and bridges along the 72.5 kilometre expressway.  https://t.co/QZYUbhTtJR — by @binodjourno",en,"[{'screen_name': 'binodjourno', 'name': 'binod ghimire', 'id': '3348257833'}]",['https://tkpo.st/3gFPsVI'],[],0,0,10,[],[],https://twitter.com/kathmandupost/status/1386421003006332929,False,,0,,,,,,,,[],,,,
1386394584184352768,1386394584184352768,2021-04-26 00:45:01 +0545,2021-04-26,00:45:01,+0545,625760052,kathmandupost,The Kathmandu Post,,OPINION: New world disorder and South Asia  India’s peaceful growth principles are beckoning for all the good reasons.  https://t.co/CuIopQCPLZ — by @atul_mdb,en,"[{'screen_name': 'atul_mdb', 'name': 'atul k thakur', 'id': '100743856'}]",['https://tkpo.st/3exFvaj'],[],0,0,3,[],[],https://twitter.com/kathmandupost/status/1386394584184352768,False,,0,,,,,,,,[],,,,
1386368154859933696,1386368154859933696,2021-04-25 23:00:00 +0545,2021-04-25,23:00:00,+0545,625760052,kathmandupost,The Kathmandu Post,,"Amid fears of oxygen shortage, government talks to suppliers  Manufacturers say production is sufficient at present but supply could be affected if hospitals start hoarding oxygen.  https://t.co/Zs7lGj0IID — by @journoprithvi",en,"[{'screen_name': 'journoprithvi', 'name': 'prithvi shrestha', 'id': '1407144090'}]",['https://tkpo.st/3aCBVut'],[],0,1,10,[],[],https://twitter.com/kathmandupost/status/1386368154859933696,False,,0,,,,,,,,[],,,,
1386341731021430788,1386341731021430788,2021-04-25 21:15:00 +0545,2021-04-25,21:15:00,+0545,625760052,kathmandupost,The Kathmandu Post,,People ignoring social distancing despite spike in infections  https://t.co/8zmBvqO8dR — by @dhungana_shuvam,en,"[{'screen_name': 'dhungana_shuvam', 'name': 'shuvam dhungana', 'id': '1070255257534500865'}]",['https://tkpo.st/3nhBavI'],[],1,2,22,[],[],https://twitter.com/kathmandupost/status/1386341731021430788,False,,0,,,,,,,,[],,,,
1386315306851659780,1386315306851659780,2021-04-25 19:30:00 +0545,2021-04-25,19:30:00,+0545,625760052,kathmandupost,The Kathmandu Post,,"As cases surge and hospitals fill up, doctors are worried  With only seriously ill cases coming for treatment, doctors say that the virus is much more widespread than daily infection data shows and the next two months will be critical.  https://t.co/Fap9MBi9aH — by @arjunpoudeltkp",en,"[{'screen_name': 'arjunpoudeltkp', 'name': 'arjun poudel', 'id': '86678613'}]",['http://tkpo.st/2QZfKaU'],[],0,4,9,[],[],https://twitter.com/kathmandupost/status/1386315306851659780,False,,0,,,,,,,,[],,,,
1386297691022315528,1386297691022315528,2021-04-25 18:20:00 +0545,2021-04-25,18:20:00,+0545,625760052,kathmandupost,The Kathmandu Post,,"Prohibitory order to be imposed in Banke from Monday midnight  Issuing a notice on Sunday, the District Administration Office asked the public to refrain from going out unnecessarily.  https://t.co/EVGwv13Py0 — by Thakur Singh Tharu",en,[],['https://tkpo.st/32M1Jjk'],[],0,0,11,[],[],https://twitter.com/kathmandupost/status/1386297691022315528,False,,0,,,,,,,,[],,,,
1386292230277664768,1386292230277664768,2021-04-25 17:58:18 +0545,2021-04-25,17:58:18,+0545,625760052,kathmandupost,The Kathmandu Post,,Valley’s district administration offices halts services other than essential ones for a week  The decision comes as several officials at the Kathmandu District Administration Office tested positive for Covid-19.    https://t.co/97PinKZ4NQ,en,[],['https://tkpo.st/3tUkey6'],[],2,4,6,[],[],https://twitter.com/kathmandupost/status/1386292230277664768,False,,0,,,,,,,,[],,,,
1386288379046895616,1386288379046895616,2021-04-25 17:43:00 +0545,2021-04-25,17:43:00,+0545,625760052,kathmandupost,The Kathmandu Post,,UML to take action against lawmakers close to Nepal to prevent them voting for potential no-confidence motion   https://t.co/dWEguUNviv,en,[],['https://tkpo.st/3viydxT'],[],0,0,4,[],[],https://twitter.com/kathmandupost/status/1386288379046895616,False,,0,,,,,,,,[],,,,
1386280991509995520,1386280991509995520,2021-04-25 17:13:38 +0545,2021-04-25,17:13:38,+0545,625760052,kathmandupost,The Kathmandu Post,,"Nepal’s Covid-19 toll reaches 3,164 with 28 more deaths  With 3,032 new infections recorded in the past 24 hours, the active case count stands at 19,382 according to the Ministry of Health and Population.   https://t.co/FjS58Tc7aP",en,[],['https://tkpo.st/2PkkwPA'],[],1,0,4,[],[],https://twitter.com/kathmandupost/status/1386280991509995520,False,,0,,,,,,,,[],,,,
1386278655664394240,1386278655664394240,2021-04-25 17:04:21 +0545,2021-04-25,17:04:21,+0545,625760052,kathmandupost,The Kathmandu Post,,"With countries closing their borders classes are online and paying colleges for that is not worth it, says government as reason for not issuing no objection letters to study in five countries.  https://t.co/IRCFxf8zAv — by @dhungana_shuvam",en,"[{'screen_name': 'dhungana_shuvam', 'name': 'shuvam dhungana', 'id': '1070255257534500865'}]",['https://tkpo.st/2PqWouQ'],[],1,1,7,[],[],https://twitter.com/kathmandupost/status/1386278655664394240,False,,0,,,,,,,,[],,,,
1386270432269983746,1386270432269983746,2021-04-25 16:31:41 +0545,2021-04-25,16:31:41,+0545,625760052,kathmandupost,The Kathmandu Post,,Health Ministry calls on all to adhere to safety measures as cases rise   https://t.co/WVcZ6ZGu41,en,[],['https://tkpo.st/3aBSA1d'],[],1,1,25,[],[],https://twitter.com/kathmandupost/status/1386270432269983746,False,,0,,,,,,,,[],,,,
1386254425132466180,1386254425132466180,2021-04-25 15:28:04 +0545,2021-04-25,15:28:04,+0545,625760052,kathmandupost,The Kathmandu Post,,Authorities decide to close educational institutions in Rupandehi from Sunday  A meeting of the chiefs of all 16 local units in the district also decided to enforce odd-even vehicle rule from Tuesday amid coronavirus concerns.  https://t.co/AIgyA8eYjg — by Sanju Paudel,en,[],['https://tkpo.st/3tQMYrr'],[],0,1,6,[],[],https://twitter.com/kathmandupost/status/1386254425132466180,False,,0,,,,,,,,[],,,,
1386224709520424962,1386224709520424962,2021-04-25 13:30:00 +0545,2021-04-25,13:30:00,+0545,625760052,kathmandupost,The Kathmandu Post,,"As Covid-19 cases surge, bus operators worry about another lockdown   https://t.co/JJls6BQaB2 — by @AnupOjha7",en,"[{'screen_name': 'anupojha7', 'name': 'anup', 'id': '1122084464'}]",['https://tkpo.st/2PmnHGA'],[],0,0,10,[],[],https://twitter.com/kathmandupost/status/1386224709520424962,False,,0,,,,,,,,[],,,,
1386223288993554433,1386223288993554433,2021-04-25 13:24:21 +0545,2021-04-25,13:24:21,+0545,625760052,kathmandupost,The Kathmandu Post,,"India coronavirus cases set new global record, US readies help  India’s total tally of infections stands at 16.96 million and deaths 192,311 after 2,767 more died overnight, health ministry data showed.   https://t.co/Y82nHrMokC",en,[],['https://tkpo.st/3aCfnKm'],[],0,4,15,[],[],https://twitter.com/kathmandupost/status/1386223288993554433,False,,0,,,,,,,,[],,,,
1386217159819399173,1386217159819399173,2021-04-25 13:00:00 +0545,2021-04-25,13:00:00,+0545,625760052,kathmandupost,The Kathmandu Post,,"Chinese border closure hits Nepali entrepreneurs hard  With no export orders, manufacturers and exporters are facing tough times and have started looking for other sources of income observing the situation.   https://t.co/8RHY6nE05Y — by @PrasainKrishana",en,"[{'screen_name': 'prasainkrishana', 'name': 'krishana prasain', 'id': '2236195390'}]",['https://tkpo.st/3eqOudn'],[],1,3,20,[],[],https://twitter.com/kathmandupost/status/1386217159819399173,False,,0,,,,,,,,[],,,,
1386204576974446594,1386204576974446594,2021-04-25 12:10:00 +0545,2021-04-25,12:10:00,+0545,625760052,kathmandupost,The Kathmandu Post,,Lax health security checks in Darchula border points  There is no official record of entries through the other five border points in Darchula.   https://t.co/ZRuG8Xvs7Y — by Manoj Badu,en,[],['https://tkpo.st/2QTcXQu'],[],0,3,7,[],[],https://twitter.com/kathmandupost/status/1386204576974446594,False,,0,,,,,,,,[],,,,
1386186960776093697,1386186960776093697,2021-04-25 11:00:00 +0545,2021-04-25,11:00:00,+0545,625760052,kathmandupost,The Kathmandu Post,,OPINION: New world disorder and South Asia  India’s peaceful growth principles are beckoning for all the good reasons.   https://t.co/CuIopQleUr — by @atul_mdb,en,"[{'screen_name': 'atul_mdb', 'name': 'atul k thakur', 'id': '100743856'}]",['https://tkpo.st/3exFvaj'],[],1,2,10,[],[],https://twitter.com/kathmandupost/status/1386186960776093697,False,,0,,,,,,,,[],,,,
1386179410978643969,1386179410978643969,2021-04-25 10:30:00 +0545,2021-04-25,10:30:00,+0545,625760052,kathmandupost,The Kathmandu Post,,Kathmandu beat Lalitpur in Nepal Super League opener   https://t.co/suUtMXzXGg,in,[],['https://tkpo.st/3aDzB6h'],[],0,0,16,[],[],https://twitter.com/kathmandupost/status/1386179410978643969,False,,0,,,,,,,,[],,,,
1386174377784352768,1386174377784352768,2021-04-25 10:10:00 +0545,2021-04-25,10:10:00,+0545,625760052,kathmandupost,The Kathmandu Post,,Ministry quizzed over delay in scrapping contractor selection   https://t.co/QZYUbhTtJR — by  @binodjourno,en,"[{'screen_name': 'binodjourno', 'name': 'binod ghimire', 'id': '3348257833'}]",['https://tkpo.st/3gFPsVI'],[],0,2,9,[],[],https://twitter.com/kathmandupost/status/1386174377784352768,False,,0,,,,,,,,[],,,,
1386159278407487489,1386159278407487489,2021-04-25 09:10:00 +0545,2021-04-25,09:10:00,+0545,625760052,kathmandupost,The Kathmandu Post,,OPINION: Nepali sculpture and modernity debate  An important feature of modern Nepali sculpture is the creative activism of the artists.   https://t.co/WSc2er684L — by Abhi Subedi,en,[],['https://tkpo.st/3tPgtKb'],[],0,0,8,[],[],https://twitter.com/kathmandupost/status/1386159278407487489,False,,0,,,,,,,,[],,,,
1386149212006490116,1386149212006490116,2021-04-25 08:30:00 +0545,2021-04-25,08:30:00,+0545,625760052,kathmandupost,The Kathmandu Post,,"When officials and politicians themselves have been organizing functions and rallies in defiance of Covid restrictions, ordinary people have stopped taking the precautions, experts say.   https://t.co/8zmBvqO8dR — by @dhungana_shuvam",en,"[{'screen_name': 'dhungana_shuvam', 'name': 'shuvam dhungana', 'id': '1070255257534500865'}]",['https://tkpo.st/3nhBavI'],[],1,3,36,[],[],https://twitter.com/kathmandupost/status/1386149212006490116,False,,0,,,,,,,,[],,,,
1386138447979499523,1386138447979499523,2021-04-25 07:47:13 +0545,2021-04-25,07:47:13,+0545,625760052,kathmandupost,The Kathmandu Post,,"Amid fears of oxygen shortage, government talks to suppliers   https://t.co/Zs7lGjijAb — by @journoprithvi",en,"[{'screen_name': 'journoprithvi', 'name': 'prithvi shrestha', 'id': '1407144090'}]",['https://tkpo.st/3aCBVut'],[],0,6,17,[],[],https://twitter.com/kathmandupost/status/1386138447979499523,False,,0,,,,,,,,[],,,,
1386135977937145864,1386135977937145864,2021-04-25 07:37:24 +0545,2021-04-25,07:37:24,+0545,625760052,kathmandupost,The Kathmandu Post,,"As cases surge and hospitals fill up, doctors are worried  With only seriously ill cases coming for treatment, doctors say that the virus is much more widespread than daily infection data shows and the next two months will be critical.  https://t.co/k5kgfL8KHP — by @arjunpoudeltkp",en,"[{'screen_name': 'arjunpoudeltkp', 'name': 'arjun poudel', 'id': '86678613'}]",['https://tkpo.st/2QZfKaU'],[],0,6,20,[],[],https://twitter.com/kathmandupost/status/1386135977937145864,False,,0,,,,,,,,[],,,,
1386119013000908803,1386119013000908803,2021-04-25 06:30:00 +0545,2021-04-25,06:30:00,+0545,625760052,kathmandupost,The Kathmandu Post,,"Ainaa—mirroring our society  Launched in January, Ainaa, a social reality TV show, highlights Nepal’s many social issues.   https://t.co/DS0OcprKhk — by @TseringNgodupL1",en,"[{'screen_name': 'tseringngodupl1', 'name': 'tsering ngodup lama', 'id': '1080003818857943040'}]",['http://tkpo.st/32IQMz8'],[],1,4,18,[],[],https://twitter.com/kathmandupost/status/1386119013000908803,False,,0,,,,,,,,[],,,,
1386066165248712706,1386066165248712706,2021-04-25 03:00:00 +0545,2021-04-25,03:00:00,+0545,625760052,kathmandupost,The Kathmandu Post,,Hospitals across Lumbini overwhelmed with increasing Covid-19 caseload   https://t.co/Tsmw2MgBiG — by Madhu Shahi &amp; Thakur Singh Tharu,en,[],['http://tkpo.st/2QUv8VD'],[],1,3,19,[],[],https://twitter.com/kathmandupost/status/1386066165248712706,False,,0,,,,,,,,[],,,,
1386047292373757953,1386047292373757953,2021-04-25 01:45:00 +0545,2021-04-25,01:45:00,+0545,625760052,kathmandupost,The Kathmandu Post,,"Most handwashing stations installed in Valley last year are not in working condition  Authorities say they are working to repair and restore such stations but even after four days since the commitment, the situation remains the same.   https://t.co/MvLJX1TWtI — by @AnupOjha7",en,"[{'screen_name': 'anupojha7', 'name': 'anup', 'id': '1122084464'}]",['http://tkpo.st/3dOtYnX'],[],0,0,13,[],[],https://twitter.com/kathmandupost/status/1386047292373757953,False,,0,,,,,,,,[],,,,
1386013317269966858,1386013317269966858,2021-04-24 23:30:00 +0545,2021-04-24,23:30:00,+0545,625760052,kathmandupost,The Kathmandu Post,,Retailers urge the government to probe rising food prices  Essential goods have become costlier in the past few days despite sufficient stocks and regular supply.   https://t.co/8hIbONrn6d — by @PrasainKrishana,en,"[{'screen_name': 'prasainkrishana', 'name': 'krishana prasain', 'id': '2236195390'}]",['http://tkpo.st/32IWQro'],[],0,1,3,[],[],https://twitter.com/kathmandupost/status/1386013317269966858,False,,0,,,,,,,,[],,,,
1386005390349856769,1386005390349856769,2021-04-24 22:58:30 +0545,2021-04-24,22:58:30,+0545,625760052,kathmandupost,The Kathmandu Post,,Nepal thump the Netherlands to clinch first T20 title  The hosts thrashed the Dutch by 142 runs to register their highest run-margin victory in a T20I after the player-of-the-series Bhurtel scored his fourth half-century of the Series.   https://t.co/z49s2DcvIH,en,[],['https://tkpo.st/3tOP1vT'],[],1,2,32,[],[],https://twitter.com/kathmandupost/status/1386005390349856769,False,,0,,,,,,,,[],,,,
1385994982201331715,1385994982201331715,2021-04-24 22:17:08 +0545,2021-04-24,22:17:08,+0545,625760052,kathmandupost,The Kathmandu Post,,Only five private labs allowed to conduct Covid test on foreign travellers  The decision has come after private labs were involved in producing fake Covid-19 negative reports to those travelling abroad.   https://t.co/fJQ2qZxpLO — by @CK_Mandal,en,"[{'screen_name': 'ck_mandal', 'name': 'chandan kumar mandal 🐘🐅🦏', 'id': '872168798'}]",['https://tkpo.st/3gCNPbw'],[],0,3,17,[],[],https://twitter.com/kathmandupost/status/1385994982201331715,False,,0,,,,,,,,[],,,,
1385980601233141763,1385980601233141763,2021-04-24 21:20:00 +0545,2021-04-24,21:20:00,+0545,625760052,kathmandupost,The Kathmandu Post,,"After Nepal Communist Party, now CPN-UML heading towards vertical split  Oli constitutes a 19-member Standing Committee excluding leaders close to leader Nepal in an indication that the two leaders are prepared to go their separate ways.   https://t.co/0bwXdNy3FE — by @tikapradhan",en,"[{'screen_name': 'tikapradhan', 'name': 'tika r pradhan', 'id': '359932403'}]",['http://tkpo.st/3vd7zGA'],[],0,0,7,[],[],https://twitter.com/kathmandupost/status/1385980601233141763,False,,0,,,,,,,,[],,,,
1385980173296705543,1385980173296705543,2021-04-24 21:18:18 +0545,2021-04-24,21:18:18,+0545,625760052,kathmandupost,The Kathmandu Post,,Dozens killed in wildlife attacks across the country  Government figures show human-wildlife conflicts and casualties are increasing.   https://t.co/SuHoxUmqRd — by @CK_Mandal,en,"[{'screen_name': 'ck_mandal', 'name': 'chandan kumar mandal 🐘🐅🦏', 'id': '872168798'}]",['https://tkpo.st/3tQrMl9'],[],1,2,13,[],[],https://twitter.com/kathmandupost/status/1385980173296705543,False,,0,,,,,,,,[],,,,
1385968018249953285,1385968018249953285,2021-04-24 20:30:00 +0545,2021-04-24,20:30:00,+0545,625760052,kathmandupost,The Kathmandu Post,,Everest saw its first Covid-19 case last week and this week all-time high number of permits  https://t.co/vLfi5YQtRH — by @sangamprasai,en,"[{'screen_name': 'sangamprasai', 'name': 'sangam prasain', 'id': '141498313'}]",['http://tkpo.st/3aAKFkv'],[],0,5,15,[],[],https://twitter.com/kathmandupost/status/1385968018249953285,False,,0,,,,,,,,[],,,,
1385950402240294915,1385950402240294915,2021-04-24 19:20:00 +0545,2021-04-24,19:20:00,+0545,625760052,kathmandupost,The Kathmandu Post,,"A second wave prompting a new exodus  Fearing lockdown, people are leaving Valley to avoid the trouble they faced last year.   https://t.co/tZzxjGJApV — by @AnupOjha7",en,"[{'screen_name': 'anupojha7', 'name': 'anup', 'id': '1122084464'}]",['http://tkpo.st/3eqrcUQ'],[],0,2,16,[],[],https://twitter.com/kathmandupost/status/1385950402240294915,False,,0,,,,,,,,[],,,,
1385937965533130755,1385937965533130755,2021-04-24 18:30:35 +0545,2021-04-24,18:30:35,+0545,625760052,kathmandupost,The Kathmandu Post,,Indonesian Navy says missing KRI Nanggala 402 sank   https://t.co/tEWoAF0QAk,in,[],['https://tkpo.st/3sLrAlR'],[],0,0,7,[],[],https://twitter.com/kathmandupost/status/1385937965533130755,False,,0,,,,,,,,[],,,,
1385934323002478594,1385934323002478594,2021-04-24 18:16:06 +0545,2021-04-24,18:16:06,+0545,625760052,kathmandupost,The Kathmandu Post,,"Asean to send delegation and aid to Myanmar  Myanmar, Asean's poorest country, was already struggling to cope with the Covid-19 pandemic before the Feb 1 coup and the political crisis has only deepened the desperation.   https://t.co/ZgoEViL48S",en,[],['https://tkpo.st/3xklYmc'],[],0,0,4,[],[],https://twitter.com/kathmandupost/status/1385934323002478594,False,,0,,,,,,,,[],,,,
1385931921926983682,1385931921926983682,2021-04-24 18:06:34 +0545,2021-04-24,18:06:34,+0545,625760052,kathmandupost,The Kathmandu Post,,"One killed, 22 injured in bus accident in Khotang  The bus was carrying 40 pilgrims. Eight of the injured have been referred to Biratnagar for treatment.   https://t.co/KhamQqug0Q — by Damber Singh Rai",en,[],['https://tkpo.st/3sN0zyw'],[],0,0,6,[],[],https://twitter.com/kathmandupost/status/1385931921926983682,False,,0,,,,,,,,[],,,,
1385915169923022849,1385915169923022849,2021-04-24 17:00:00 +0545,2021-04-24,17:00:00,+0545,625760052,kathmandupost,The Kathmandu Post,,"The government’s request to supply oxygen, antiviral drug and intensive care beds when the crisis has already hit exposes its lack of preparedness despite several warnings, experts say.   https://t.co/htf4rQfjRn — by @anilkathmandu",en,"[{'screen_name': 'anilkathmandu', 'name': 'अनिल गिरी', 'id': '223064868'}]",['http://tkpo.st/3sL0NpV'],[],0,2,21,[],[],https://twitter.com/kathmandupost/status/1385915169923022849,False,,0,,,,,,,,[],,,,
1385911836847984647,1385911836847984647,2021-04-24 16:46:45 +0545,2021-04-24,16:46:45,+0545,625760052,kathmandupost,The Kathmandu Post,,"Nepal’s Covid-19 toll reaches 3,136 with 14 more deaths   https://t.co/rsUQLVPRhV",en,[],['https://tkpo.st/3gCirdc'],[],0,2,13,[],[],https://twitter.com/kathmandupost/status/1385911836847984647,False,,0,,,,,,,,[],,,,
1385884970909110274,1385884970909110274,2021-04-24 15:00:00 +0545,2021-04-24,15:00:00,+0545,625760052,kathmandupost,The Kathmandu Post,,"Ainaa—mirroring our society  Launched in January, Ainaa, a social reality TV show, highlights Nepal’s many social issues.   https://t.co/NIg1zZbZeO — by @TseringNgodupL1",en,"[{'screen_name': 'tseringngodupl1', 'name': 'tsering ngodup lama', 'id': '1080003818857943040'}]",['https://tkpo.st/32IQMz8'],[],0,3,12,[],[],https://twitter.com/kathmandupost/status/1385884970909110274,False,,0,,,,,,,,[],,,,
1385859805177270274,1385859805177270274,2021-04-24 13:20:00 +0545,2021-04-24,13:20:00,+0545,625760052,kathmandupost,The Kathmandu Post,,Everest saw its first Covid-19 case last week and this week all-time high number of permits   https://t.co/vLfi5YySt7 — by @sangamprasai,en,"[{'screen_name': 'sangamprasai', 'name': 'sangam prasain', 'id': '141498313'}]",['http://tkpo.st/3aAKFkv'],[],0,2,12,[],[],https://twitter.com/kathmandupost/status/1385859805177270274,False,,0,,,,,,,,[],,,,
1385841612278824960,1385841612278824960,2021-04-24 12:07:42 +0545,2021-04-24,12:07:42,+0545,625760052,kathmandupost,The Kathmandu Post,,India’s daily coronavirus cases climb to new world record as hospitals buckle   https://t.co/sfXP3CU4LG,en,[],['https://tkpo.st/3aDJ0Lg'],[],1,2,40,[],[],https://twitter.com/kathmandupost/status/1385841612278824960,False,,0,,,,,,,,[],,,,
1385834639177179137,1385834639177179137,2021-04-24 11:40:00 +0545,2021-04-24,11:40:00,+0545,625760052,kathmandupost,The Kathmandu Post,,Hospitals across Lumbini overwhelmed with increasing Covid-19 caseload   https://t.co/Tsmw2MgBiG — by Madhu Shahi &amp; Thakur Singh Tharu,en,[],['http://tkpo.st/2QUv8VD'],[],0,2,16,[],[],https://twitter.com/kathmandupost/status/1385834639177179137,False,,0,,,,,,,,[],,,,
1385817023213498370,1385817023213498370,2021-04-24 10:30:00 +0545,2021-04-24,10:30:00,+0545,625760052,kathmandupost,The Kathmandu Post,,"Most handwashing stations installed in Valley last year are not in working condition  Authorities say they are working to repair and restore such stations but even after four days since the commitment, the situation remains the same.   https://t.co/90Q2gTIzRw — by @AnupOjha7",en,"[{'screen_name': 'anupojha7', 'name': 'anup', 'id': '1122084464'}]",['https://tkpo.st/3dOtYnX'],[],0,0,5,[],[],https://twitter.com/kathmandupost/status/1385817023213498370,False,,0,,,,,,,,[],,,,
1385801923689910274,1385801923689910274,2021-04-24 09:30:00 +0545,2021-04-24,09:30:00,+0545,625760052,kathmandupost,The Kathmandu Post,,Retailers urge the government to probe rising food prices  Essential goods have become costlier in the past few days despite sufficient stocks and regular supply.   https://t.co/LdDgwoTz2g — by @PrasainKrishana,en,"[{'screen_name': 'prasainkrishana', 'name': 'krishana prasain', 'id': '2236195390'}]",['https://tkpo.st/32IWQro'],[],0,1,15,[],[],https://twitter.com/kathmandupost/status/1385801923689910274,False,,0,,,,,,,,[],,,,
1385796890546130945,1385796890546130945,2021-04-24 09:10:00 +0545,2021-04-24,09:10:00,+0545,625760052,kathmandupost,The Kathmandu Post,,"Nepal meet the Netherlands in final today  The hosts showed their domination in the Tri-Nation T20I Series, thumping the Dutch side by nine wickets in their first meeting but were undone when the visitors chased down Nepal’s second-highest total.   https://t.co/H6qDH1yUUR",en,[],['https://tkpo.st/3vepxbN'],[],0,1,12,[],[],https://twitter.com/kathmandupost/status/1385796890546130945,False,,0,,,,,,,,[],,,,
1385791858203185157,1385791858203185157,2021-04-24 08:50:00 +0545,2021-04-24,08:50:00,+0545,625760052,kathmandupost,The Kathmandu Post,,"After Nepal Communist Party, now CPN-UML heading towards vertical split  Oli constitutes a 19-member Standing Committee excluding leaders close to leader Nepal in an indication that the two leaders are prepared to go their separate ways.   https://t.co/P1y7JDmboG — by @tikapradhan",en,"[{'screen_name': 'tikapradhan', 'name': 'tika r pradhan', 'id': '359932403'}]",['https://tkpo.st/3vd7zGA'],[],0,2,6,[],[],https://twitter.com/kathmandupost/status/1385791858203185157,False,,0,,,,,,,,[],,,,
1385785962924371968,1385785962924371968,2021-04-24 08:26:34 +0545,2021-04-24,08:26:34,+0545,625760052,kathmandupost,The Kathmandu Post,,"A second wave prompting a new exodus  Fearing lockdown, people are leaving Valley to avoid the trouble they faced last year.   https://t.co/EOJWoUmWnb — by @AnupOjha7",en,"[{'screen_name': 'anupojha7', 'name': 'anup', 'id': '1122084464'}]",['https://tkpo.st/3eqrcUQ'],[],0,3,23,[],[],https://twitter.com/kathmandupost/status/1385785962924371968,False,,0,,,,,,,,[],,,,
1385780133491929092,1385780133491929092,2021-04-24 08:03:25 +0545,2021-04-24,08:03:25,+0545,625760052,kathmandupost,The Kathmandu Post,,"The government’s request to supply oxygen, antiviral drug and intensive care beds when the crisis has already hit exposes its lack of preparedness despite several warnings, experts say.   https://t.co/YPLQsGkPak — by @anilkathmandu",en,"[{'screen_name': 'anilkathmandu', 'name': 'अनिल गिरी', 'id': '223064868'}]",['https://tkpo.st/3sL0NpV'],[],1,7,21,[],[],https://twitter.com/kathmandupost/status/1385780133491929092,False,,0,,,,,,,,[],,,,
