id,conversation_id,created_at,date,time,timezone,user_id,username,name,place,tweet,language,mentions,urls,photos,replies_count,retweets_count,likes_count,hashtags,cashtags,link,retweet,quote_url,video,thumbnail,near,geo,source,user_rt_id,user_rt,retweet_id,reply_to,retweet_date,translate,trans_src,trans_dest
1385102491042283521,1385102491042283521,2021-04-22 11:10:42 +0545,2021-04-22,11:10:42,+0545,625760052,kathmandupost,The Kathmandu Post,,"India reported on Thursday 314,835 new cases of the coronavirus over the previous 24 hours, the highest daily increase recorded anywhere, as its second wave and similar surges elsewhere in the world raised new fears about the virus.   https://t.co/2ngkew3FDj",en,[],['https://tkpo.st/3n8jbYJ'],[],0,2,6,[],[],https://twitter.com/kathmandupost/status/1385102491042283521,False,,0,,,,,,,,[],,,,
1385099797103788039,1385099797103788039,2021-04-22 11:00:00 +0545,2021-04-22,11:00:00,+0545,625760052,kathmandupost,The Kathmandu Post,,"Hosts Nepal and the Netherlands were assured of final spots in the Tri-Nation Twenty20 International Series after Malaysia and the Dutch side's rain affected group match was tied at the TU cricket ground, Kirtipur on Wednesday.    https://t.co/YURIYSsNRk",en,[],['https://tkpo.st/3auzXfw'],[],0,1,13,[],[],https://twitter.com/kathmandupost/status/1385099797103788039,False,,0,,,,,,,,[],,,,
1385089730891689984,1385089730891689984,2021-04-22 10:20:00 +0545,2021-04-22,10:20:00,+0545,625760052,kathmandupost,The Kathmandu Post,,"Amid a spike in new cases of Covid-19 throughout the country, the Ministry of Health and Population has directed agencies concerned to keep 20 ambulances on standby for infected patients in the Kathmandu Valley.  https://t.co/ABsYkhnkZE — by @arjunpoudeltkp",en,"[{'screen_name': 'arjunpoudeltkp', 'name': 'arjun poudel', 'id': '86678613'}]",['https://tkpo.st/3dETGLl'],[],1,2,8,[],[],https://twitter.com/kathmandupost/status/1385089730891689984,False,,0,,,,,,,,[],,,,
1385079664524283905,1385079664524283905,2021-04-22 09:40:00 +0545,2021-04-22,09:40:00,+0545,625760052,kathmandupost,The Kathmandu Post,,172 passengers were turned away from Tribhuvan International Airport for furnishing Covid-19 negative results from the labs that were caught issuing reports to foreign job aspirants without testing them.  https://t.co/Oe9KvKAkC5 — by @CK_Mandal,en,"[{'screen_name': 'ck_mandal', 'name': 'chandan kumar mandal 🐘🐅🦏', 'id': '872168798'}]",['https://tkpo.st/32IizPT'],[],2,3,22,[],[],https://twitter.com/kathmandupost/status/1385079664524283905,False,,0,,,,,,,,[],,,,
1385074631665610754,1385074631665610754,2021-04-22 09:20:00 +0545,2021-04-22,09:20:00,+0545,625760052,kathmandupost,The Kathmandu Post,,Remdesivir appears safe for seriously ill children; patients may not pose highest risk to hospital staff   https://t.co/foiuUpk7Lb,en,[],['https://tkpo.st/32Iku73'],[],0,0,2,[],[],https://twitter.com/kathmandupost/status/1385074631665610754,False,,0,,,,,,,,[],,,,
1385069598429487105,1385069598429487105,2021-04-22 09:00:00 +0545,2021-04-22,09:00:00,+0545,625760052,kathmandupost,The Kathmandu Post,,OPINION: Legalise marijuana  Nepal should look into the prospects of the constructive use of cannabis.  https://t.co/KiQkdSGb68 — by @RosheeLC,en,"[{'screen_name': 'rosheelc', 'name': 'roshee lamichhane(रोशी)', 'id': '1103652330254319617'}]",['https://tkpo.st/3xlui5p'],[],0,25,71,[],[],https://twitter.com/kathmandupost/status/1385069598429487105,False,,0,,,,,,,,[],,,,
1385061293594394628,1385061293594394628,2021-04-22 08:27:00 +0545,2021-04-22,08:27:00,+0545,625760052,kathmandupost,The Kathmandu Post,,"Nepal sets climber quotas to prevent crowds on Everest  Tourism Department has issued Everest permits to 377 individuals so far, and the number is expected to rise close to 400.  https://t.co/aqNY4hgcWO — by @sangamprasai",en,"[{'screen_name': 'sangamprasai', 'name': 'sangam prasain', 'id': '141498313'}]",['https://tkpo.st/3eiy1I5'],[],0,2,11,[],[],https://twitter.com/kathmandupost/status/1385061293594394628,False,,0,,,,,,,,[],,,,
1385053743759069186,1385053743759069186,2021-04-22 07:57:00 +0545,2021-04-22,07:57:00,+0545,625760052,kathmandupost,The Kathmandu Post,,"Lives vs livelihoods? Amid a surge in virus cases, lockdown fears loom  Authorities must devise strategies to contain the spread without imposing blanket restrictions as such curbs can severely impact the economy and the people.  https://t.co/V7nTTIOcHQ — by @journoprithvi",en,"[{'screen_name': 'journoprithvi', 'name': 'prithvi shrestha', 'id': '1407144090'}]",['https://tkpo.st/3sDOY4P'],[],1,3,19,[],[],https://twitter.com/kathmandupost/status/1385053743759069186,False,,0,,,,,,,,[],,,,
1385046194003615750,1385046194003615750,2021-04-22 07:27:00 +0545,2021-04-22,07:27:00,+0545,625760052,kathmandupost,The Kathmandu Post,,EDITORIAL: Red alert  The government has to stop waiting for things to turn worse and urgently prepare for a worst-case scenario.   https://t.co/PfcBeXBQdP,en,[],['https://tkpo.st/3dE2wJk'],[],0,4,20,[],[],https://twitter.com/kathmandupost/status/1385046194003615750,False,,0,,,,,,,,[],,,,
1385035628505669633,1385035628505669633,2021-04-22 06:45:01 +0545,2021-04-22,06:45:01,+0545,625760052,kathmandupost,The Kathmandu Post,,District hospital in Nawalparasi (East) not operating at its full capacity   https://t.co/xCymVh4bsC — by Narayan Sharma,en,[],['https://tkpo.st/2QFDQY2'],[],0,2,8,[],[],https://twitter.com/kathmandupost/status/1385035628505669633,False,,0,,,,,,,,[],,,,
1385023041697103872,1385023041697103872,2021-04-22 05:55:00 +0545,2021-04-22,05:55:00,+0545,625760052,kathmandupost,The Kathmandu Post,,"Most hospitals do not have ready supply of oxygen  Experts criticise lax preparations as the Health Ministry projects an additional 300,000 Covid-19 cases by July.   https://t.co/bUz2zSYQjW — by @arjunpoudeltkp",en,"[{'screen_name': 'arjunpoudeltkp', 'name': 'arjun poudel', 'id': '86678613'}]",['http://tkpo.st/2Qmwhp7'],[],0,2,5,[],[],https://twitter.com/kathmandupost/status/1385023041697103872,False,,0,,,,,,,,[],,,,
1385004167102672903,1385004167102672903,2021-04-22 04:40:00 +0545,2021-04-22,04:40:00,+0545,625760052,kathmandupost,The Kathmandu Post,,OPINION: An old mindset prevails  Public confidence in federalism is waning because of the Constituency Development Programme.   https://t.co/59t91XcdPm — by Khim Lal Devkota,en,[],['http://tkpo.st/3apvNW1'],[],0,1,2,[],[],https://twitter.com/kathmandupost/status/1385004167102672903,False,,0,,,,,,,,[],,,,
1384982776420700161,1384982776420700161,2021-04-22 03:15:00 +0545,2021-04-22,03:15:00,+0545,625760052,kathmandupost,The Kathmandu Post,,"Apple farmers in Manang grow new varieties at higher altitudes  Apple is grown on 11,186 hectares in Nepal, with an annual output of 31,386 tonnes.   https://t.co/o0EGQj5j7Q — by Aash Gurung",en,[],['http://tkpo.st/3n7tOL7'],[],0,1,9,[],[],https://twitter.com/kathmandupost/status/1384982776420700161,False,,0,,,,,,,,[],,,,
1384961386107736064,1384961386107736064,2021-04-22 01:50:00 +0545,2021-04-22,01:50:00,+0545,625760052,kathmandupost,The Kathmandu Post,,A day in the life of a music video director  Vidhan Karki has till date made over 80 music videos. The Post spends a day with him as he makes his latest.   https://t.co/5SJkbAs7qH — by @ankitkhadgi,en,"[{'screen_name': 'ankitkhadgi', 'name': 'ankit khadgi', 'id': '813377780146544641'}]",['http://tkpo.st/3xdjN3E'],[],0,0,2,[],[],https://twitter.com/kathmandupost/status/1384961386107736064,False,,0,,,,,,,,[],,,,
1384938736174178314,1384938736174178314,2021-04-22 00:20:00 +0545,2021-04-22,00:20:00,+0545,625760052,kathmandupost,The Kathmandu Post,,"Dead bodies have been brought in bulk from Malaysia thrice this year, but arranging flights for ferrying the bodies remains a challenge. Bodies repatriation from Saudi Arabia has been affected by lengthy bureaucracy in the Gulf kingdom.   https://t.co/MfhuJ2NJKQ — by @CK_Mandal",en,"[{'screen_name': 'ck_mandal', 'name': 'chandan kumar mandal 🐘🐅🦏', 'id': '872168798'}]",['http://tkpo.st/3gmLEIZ'],[],0,1,2,[],[],https://twitter.com/kathmandupost/status/1384938736174178314,False,,0,,,,,,,,[],,,,
1384916087360299010,1384916087360299010,2021-04-21 22:50:00 +0545,2021-04-21,22:50:00,+0545,625760052,kathmandupost,The Kathmandu Post,,"Malaysia-Netherlands tie sends Nepal into final  Malaysia, chasing a revised target of 92 runs, scored 91-4 in a rain affected day as the match tied sending the Dutch and the hosts into the Tri-Nation T20 Series final.   https://t.co/YURIYSbcsK",en,[],['https://tkpo.st/3auzXfw'],[],0,0,5,[],[],https://twitter.com/kathmandupost/status/1384916087360299010,False,,0,,,,,,,,[],,,,
1384906420378914818,1384906420378914818,2021-04-21 22:11:35 +0545,2021-04-21,22:11:35,+0545,625760052,kathmandupost,The Kathmandu Post,,"Nepal sets climber quotas to prevent crowds on Everest  The Department of Tourism has issued Everest climbing permits to 377 individuals so far, and the number is expected to rise close to 400.  https://t.co/aqNY4hgcWO — by @sangamprasai",en,"[{'screen_name': 'sangamprasai', 'name': 'sangam prasain', 'id': '141498313'}]",['https://tkpo.st/3eiy1I5'],[],0,7,29,[],[],https://twitter.com/kathmandupost/status/1384906420378914818,False,,0,,,,,,,,[],,,,
1384894192523128833,1384894192523128833,2021-04-21 21:23:00 +0545,2021-04-21,21:23:00,+0545,625760052,kathmandupost,The Kathmandu Post,,Oli and Nepal hold one-on-one meeting in signs of rapprochement  The meeting comes amid talks that the Maoist Centre is planning to withdraw its support to the government.  https://t.co/Aey4j9x2Ps — by @tikapradhan,en,"[{'screen_name': 'tikapradhan', 'name': 'tika r pradhan', 'id': '359932403'}]",['https://tkpo.st/3neSpOj'],[],0,1,6,[],[],https://twitter.com/kathmandupost/status/1384894192523128833,False,,0,,,,,,,,[],,,,
1384884630420172800,1384884630420172800,2021-04-21 20:45:00 +0545,2021-04-21,20:45:00,+0545,625760052,kathmandupost,The Kathmandu Post,,"Nepal grants conditional emergency use approval to Russian Sputnik V vaccine  This is the fourth Covid-19 vaccine to get emergency use approval after AstraZeneca’s Covishield, Bharat Biotech’s Covaxin and Sinopharm’s BBIBP-CorV.   https://t.co/MxUz1t0qMI — by @arjunpoudeltkp",en,"[{'screen_name': 'arjunpoudeltkp', 'name': 'arjun poudel', 'id': '86678613'}]",['http://tkpo.st/3sydx35'],[],0,2,13,[],[],https://twitter.com/kathmandupost/status/1384884630420172800,False,,0,,,,,,,,[],,,,
1384865755632570380,1384865755632570380,2021-04-21 19:30:00 +0545,2021-04-21,19:30:00,+0545,625760052,kathmandupost,The Kathmandu Post,,Indonesia searching for missing submarine with 53 on board   https://t.co/S7wYBLlaAU,en,[],['https://tkpo.st/32wh2fQ'],[],0,1,6,[],[],https://twitter.com/kathmandupost/status/1384865755632570380,False,,0,,,,,,,,[],,,,
1384858205365411843,1384858205365411843,2021-04-21 19:00:00 +0545,2021-04-21,19:00:00,+0545,625760052,kathmandupost,The Kathmandu Post,,"Nepali politicians are losing their moral compass, they themselves say to criticise others. Analysts say a lack of political morality among leaders is a threat to democracy.   https://t.co/3ud3pCTGQl — by @tikapradhan",en,"[{'screen_name': 'tikapradhan', 'name': 'tika r pradhan', 'id': '359932403'}]",['http://tkpo.st/3txH6mG'],[],0,2,10,[],[],https://twitter.com/kathmandupost/status/1384858205365411843,False,,0,,,,,,,,[],,,,
1384842930247057408,1384842930247057408,2021-04-21 17:59:18 +0545,2021-04-21,17:59:18,+0545,625760052,kathmandupost,The Kathmandu Post,,"Nepal’s Covid-19 toll reaches 3,112 with 10 more deaths  With 2,220 new infections recorded in the past 24 hours, the active case count stands at 10,582, according to the Ministry of Health and Population.   https://t.co/znXeFBqKRS",en,[],['https://tkpo.st/3syl55P'],[],2,4,17,[],[],https://twitter.com/kathmandupost/status/1384842930247057408,False,,0,,,,,,,,[],,,,
1384835556098682880,1384835556098682880,2021-04-21 17:30:00 +0545,2021-04-21,17:30:00,+0545,625760052,kathmandupost,The Kathmandu Post,,"As many as 67 vultures found dead in Jitpur  Investigation is underway to find the cause behind the death of the rare birds, according to District Livestock Service Office in Nawalparasi (West).  https://t.co/lqbEWFnv3m — by Nabin Paudel",en,[],['https://tkpo.st/3eqpPFU'],[],0,2,8,[],[],https://twitter.com/kathmandupost/status/1384835556098682880,False,,0,,,,,,,,[],,,,
1384830522984222722,1384830522984222722,2021-04-21 17:10:00 +0545,2021-04-21,17:10:00,+0545,625760052,kathmandupost,The Kathmandu Post,,EDITORIAL: Online classes for some  The pandemic has exposed yet another harsh reality—the digital divide.   https://t.co/im0Z8js3M3,en,[],['http://tkpo.st/3sBsVM9'],[],0,0,12,[],[],https://twitter.com/kathmandupost/status/1384830522984222722,False,,0,,,,,,,,[],,,,
1384825924521140225,1384825924521140225,2021-04-21 16:51:43 +0545,2021-04-21,16:51:43,+0545,625760052,kathmandupost,The Kathmandu Post,,"Twitter becomes platform of hope amid the despair of India's Covid crisis  People are bypassing the conventional lines of communication and turning to Twitter to crowdsource help for oxygen cylinders, hospital beds and other requirements.   https://t.co/LvmmBS2FRn",en,[],['https://tkpo.st/3xcw9cv'],[],0,8,14,[],[],https://twitter.com/kathmandupost/status/1384825924521140225,False,,0,,,,,,,,[],,,,
1384820718823567368,1384820718823567368,2021-04-21 16:31:02 +0545,2021-04-21,16:31:02,+0545,625760052,kathmandupost,The Kathmandu Post,,Supreme Court bars anti-graft agency from conducting sting operations  The bench says such an act is against the constitutional and legal provisions and the principle of the criminal justice system.   https://t.co/PWfnfHCM2c,en,[],['https://tkpo.st/3vam4v0'],[],0,1,6,[],[],https://twitter.com/kathmandupost/status/1384820718823567368,False,,0,,,,,,,,[],,,,
1384806052042997762,1384806052042997762,2021-04-21 15:32:45 +0545,2021-04-21,15:32:45,+0545,625760052,kathmandupost,The Kathmandu Post,,Lockdown to be imposed in Nepalgunj from Wednesday midnight  The Banke District Administration announced a five-day lockdown to contain the Covid-19 surge.   https://t.co/EGYQbYQfUv — by Rupa Gahatraj,en,[],['https://tkpo.st/3tF2uGC'],[],0,1,12,[],[],https://twitter.com/kathmandupost/status/1384806052042997762,False,,0,,,,,,,,[],,,,
1384802840753881088,1384802840753881088,2021-04-21 15:20:00 +0545,2021-04-21,15:20:00,+0545,625760052,kathmandupost,The Kathmandu Post,,"Blame Nepal's failure or Beijing’s displeasure, but not getting an invite for the event carries some meaning, analysts say.   https://t.co/TQDVsWxx8Z — by @anilkathmandu",en,"[{'screen_name': 'anilkathmandu', 'name': 'अनिल गिरी', 'id': '223064868'}]",['http://tkpo.st/3eosdNo'],[],3,3,29,[],[],https://twitter.com/kathmandupost/status/1384802840753881088,False,,0,,,,,,,,[],,,,
1384783211180351496,1384783211180351496,2021-04-21 14:02:00 +0545,2021-04-21,14:02:00,+0545,625760052,kathmandupost,The Kathmandu Post,,Dusty road makes travel difficult along Siddhartha Highway  The road is always covered in billowing clouds of dust after the drinking water pipes were installed using excavators.   https://t.co/oHI0ubLOQY  — by Madhav Aryal,en,[],['https://tkpo.st/32ycntP'],[],1,1,7,[],[],https://twitter.com/kathmandupost/status/1384783211180351496,False,,0,,,,,,,,[],,,,
1384775158209028098,1384775158209028098,2021-04-21 13:30:00 +0545,2021-04-21,13:30:00,+0545,625760052,kathmandupost,The Kathmandu Post,,District hospital in Nawalparasi (East) not operating at its full capacity   https://t.co/xCymVgMA42 — by Narayan Sharma,en,[],['https://tkpo.st/2QFDQY2'],[],0,0,6,[],[],https://twitter.com/kathmandupost/status/1384775158209028098,False,,0,,,,,,,,[],,,,
1384767608336044034,1384767608336044034,2021-04-21 13:00:00 +0545,2021-04-21,13:00:00,+0545,625760052,kathmandupost,The Kathmandu Post,,"Most hospitals do not have ready supply of oxygen  Experts criticise lax preparations as the Health Ministry projects an additional 300,000 Covid-19 cases by July.   https://t.co/6wpKqMFaKZ — by @arjunpoudeltkp",en,"[{'screen_name': 'arjunpoudeltkp', 'name': 'arjun poudel', 'id': '86678613'}]",['https://tkpo.st/2Qmwhp7'],[],1,5,17,[],[],https://twitter.com/kathmandupost/status/1384767608336044034,False,,0,,,,,,,,[],,,,
1384760294962913291,1384760294962913291,2021-04-21 12:30:56 +0545,2021-04-21,12:30:56,+0545,625760052,kathmandupost,The Kathmandu Post,,"Guilty verdict for George Floyd’s killer brings relief, calls for wider justice   https://t.co/u52D8R0pxd",en,[],['https://tkpo.st/3tBQQfT'],[],0,1,10,[],[],https://twitter.com/kathmandupost/status/1384760294962913291,False,,0,,,,,,,,[],,,,
1384756285782908931,1384756285782908931,2021-04-21 12:15:00 +0545,2021-04-21,12:15:00,+0545,625760052,kathmandupost,The Kathmandu Post,,"Apple farmers in Manang grow new varieties at higher altitudes  Apple is grown on 11,186 hectares in Nepal, with an annual output of 31,386 tonnes.   https://t.co/XJUcjJHBQg — by Aash Gurung",en,[],['https://tkpo.st/3n7tOL7'],[],0,4,32,[],[],https://twitter.com/kathmandupost/status/1384756285782908931,False,,0,,,,,,,,[],,,,
1384744959157293059,1384744959157293059,2021-04-21 11:30:00 +0545,2021-04-21,11:30:00,+0545,625760052,kathmandupost,The Kathmandu Post,,A day in the life of a music video director  Vidhan Karki has till date made over 80 music videos. The Post spends a day with him as he makes his latest.   https://t.co/AaSHxGARSW — by @ankitkhadgi,en,"[{'screen_name': 'ankitkhadgi', 'name': 'ankit khadgi', 'id': '813377780146544641'}]",['https://tkpo.st/3xdjN3E'],[],0,3,13,[],[],https://twitter.com/kathmandupost/status/1384744959157293059,False,,0,,,,,,,,[],,,,
1384724826548412420,1384724826548412420,2021-04-21 10:10:00 +0545,2021-04-21,10:10:00,+0545,625760052,kathmandupost,The Kathmandu Post,,OPINION: Central Asia’s Afghan route to prosperity  Two new mega-projects connecting Central and South Asia could transform Eurasian economies.   https://t.co/KT48W36Y1Z — by Djoomart Otorbaev,en,[],['https://tkpo.st/2QgpJZf'],[],0,1,5,[],[],https://twitter.com/kathmandupost/status/1384724826548412420,False,,0,,,,,,,,[],,,,
1384714760231424005,1384714760231424005,2021-04-21 09:30:00 +0545,2021-04-21,09:30:00,+0545,625760052,kathmandupost,The Kathmandu Post,,"Dead bodies have been brought in bulk from Malaysia thrice this year, but arranging flights for ferrying the bodies remains a challenge. Bodies repatriation from Saudi Arabia has been affected by lengthy bureaucracy in the Gulf kingdom.   https://t.co/BRNV54cm0N — by @CK_Mandal",en,"[{'screen_name': 'ck_mandal', 'name': 'chandan kumar mandal 🐘🐅🦏', 'id': '872168798'}]",['https://tkpo.st/3gmLEIZ'],[],1,3,8,[],[],https://twitter.com/kathmandupost/status/1384714760231424005,False,,0,,,,,,,,[],,,,
1384710352437342214,1384710352437342214,2021-04-21 09:12:29 +0545,2021-04-21,09:12:29,+0545,625760052,kathmandupost,The Kathmandu Post,,UNICEF says AstraZeneca supply problems outside India resolved   https://t.co/8f4YDp1MyS,en,[],['https://tkpo.st/3eyNaFt'],[],0,0,9,[],[],https://twitter.com/kathmandupost/status/1384710352437342214,False,,0,,,,,,,,[],,,,
1384707210350055426,1384707210350055426,2021-04-21 09:00:00 +0545,2021-04-21,09:00:00,+0545,625760052,kathmandupost,The Kathmandu Post,,"Nepal grants conditional emergency use approval to Russian Sputnik V vaccine  This is the fourth Covid-19 vaccine to get emergency use approval after AstraZeneca’s Covishield, Bharat Biotech’s Covaxin and Sinopharm’s BBIBP-CorV.   https://t.co/ndusoJIEfj — by @arjunpoudeltkp",en,"[{'screen_name': 'arjunpoudeltkp', 'name': 'arjun poudel', 'id': '86678613'}]",['https://tkpo.st/3sydx35'],[],1,7,17,[],[],https://twitter.com/kathmandupost/status/1384707210350055426,False,,0,,,,,,,,[],,,,
1384699660590215173,1384699660590215173,2021-04-21 08:30:00 +0545,2021-04-21,08:30:00,+0545,625760052,kathmandupost,The Kathmandu Post,,OPINION: An old mindset prevails  Public confidence in federalism is waning because of the Constituency Development Programme.   https://t.co/lbVrdDjLtt — by Khim Lal Devkota,en,[],['https://tkpo.st/3apvNW1'],[],0,1,4,[],[],https://twitter.com/kathmandupost/status/1384699660590215173,False,,0,,,,,,,,[],,,,
1384693338352152578,1384693338352152578,2021-04-21 08:04:52 +0545,2021-04-21,08:04:52,+0545,625760052,kathmandupost,The Kathmandu Post,,"Nepali politicians are losing their moral compass, they themselves say to criticise others. Analysts say a lack of political morality among leaders is a threat to democracy.   https://t.co/LE5cJcOQzZ — by @tikapradhan",en,"[{'screen_name': 'tikapradhan', 'name': 'tika r pradhan', 'id': '359932403'}]",['https://tkpo.st/3txH6mG'],[],0,4,23,[],[],https://twitter.com/kathmandupost/status/1384693338352152578,False,,0,,,,,,,,[],,,,
1384688789059031043,1384688789059031043,2021-04-21 07:46:48 +0545,2021-04-21,07:46:48,+0545,625760052,kathmandupost,The Kathmandu Post,,"China misses out Nepal as it hosts Boao annual conference  Blame Nepal's failure or Beijing’s displeasure, but not getting an invite for the event carries some meaning, analysts say.   https://t.co/hYuLD2YT2S — by @anilkathmandu",en,"[{'screen_name': 'anilkathmandu', 'name': 'अनिल गिरी', 'id': '223064868'}]",['https://tkpo.st/3eosdNo'],[],0,3,23,[],[],https://twitter.com/kathmandupost/status/1384688789059031043,False,,0,,,,,,,,[],,,,
1384688339853393920,1384688339853393920,2021-04-21 07:45:01 +0545,2021-04-21,07:45:01,+0545,625760052,kathmandupost,The Kathmandu Post,,EDITORIAL: Online classes for some  The pandemic has exposed yet another harsh reality—the digital divide.   https://t.co/za0fUb4H7o,en,[],['https://tkpo.st/3sBsVM9'],[],0,2,5,[],[],https://twitter.com/kathmandupost/status/1384688339853393920,False,,0,,,,,,,,[],,,,
1384661912043102211,1384661912043102211,2021-04-21 06:00:00 +0545,2021-04-21,06:00:00,+0545,625760052,kathmandupost,The Kathmandu Post,,OPINION: Building institutions  The focus on the individual must be replaced by a culture of organisation-building.   https://t.co/QbA7A6iFD8 — by @sujeevshakya,en,"[{'screen_name': 'sujeevshakya', 'name': 'sujeev shakya', 'id': '39916070'}]",['http://tkpo.st/2P1gwTX'],[],0,4,3,[],[],https://twitter.com/kathmandupost/status/1384661912043102211,False,,0,,,,,,,,[],,,,
1384631713351958530,1384631713351958530,2021-04-21 04:00:00 +0545,2021-04-21,04:00:00,+0545,625760052,kathmandupost,The Kathmandu Post,,OPINION: Britain’s benefit madness  Work is the ultimate escape from poverty. But the United Kingdom’s income-support scheme reflects a welfare ideology that fails to distinguish fantasy from reality.   https://t.co/a1A1cKhFE0 — by Robert Skidelsky,en,[],['http://tkpo.st/3n0sOsm'],[],0,1,1,[],[],https://twitter.com/kathmandupost/status/1384631713351958530,False,,0,,,,,,,,[],,,,
1384597740299116553,1384597740299116553,2021-04-21 01:45:00 +0545,2021-04-21,01:45:00,+0545,625760052,kathmandupost,The Kathmandu Post,,Import controls go as foreign exchange reserves swell  Experts say that Nepal should increase earnings from other sources and not depend too much on remittance.   https://t.co/tI6ANaqOfZ — by @journoprithvi,en,"[{'screen_name': 'journoprithvi', 'name': 'prithvi shrestha', 'id': '1407144090'}]",['http://tkpo.st/3syEq73'],[],0,0,1,[],[],https://twitter.com/kathmandupost/status/1384597740299116553,False,,0,,,,,,,,[],,,,
1384575091078356993,1384575091078356993,2021-04-21 00:15:00 +0545,2021-04-21,00:15:00,+0545,625760052,kathmandupost,The Kathmandu Post,,"Gandaki Province ill-prepared for fire incidents  Delayed response, insufficient fire engines, shortage of workers and lack of water refilling stations make disaster mitigation difficult.   https://t.co/AhGmTH4wfE — by Prakash Baral",en,[],['http://tkpo.st/3swkzFB'],[],0,1,6,[],[],https://twitter.com/kathmandupost/status/1384575091078356993,False,,0,,,,,,,,[],,,,
1384551182274859010,1384551182274859010,2021-04-20 22:40:00 +0545,2021-04-20,22:40:00,+0545,625760052,kathmandupost,The Kathmandu Post,,Nepal lose to the Netherlands despite a big total  Nepal posted a mammoth 206 runs but the Dutch team reached the target with three balls to spare after Bas de Leede scored an unbeaten 81 runs.   https://t.co/WABtMKIWPI,en,[],['https://tkpo.st/3xdcGIP'],[],0,0,14,[],[],https://twitter.com/kathmandupost/status/1384551182274859010,False,,0,,,,,,,,[],,,,
1384541959755235330,1384541959755235330,2021-04-20 22:03:21 +0545,2021-04-20,22:03:21,+0545,625760052,kathmandupost,The Kathmandu Post,,"Nepal grants conditional emergency use approval to Russian Sputnik V vaccine  This is the fourth Covid-19 vaccine to get emergency use approval after AstraZeneca’s Covishield, Bharat Biotech’s Covaxin and Sinopharm’s BBIBP-CorV.  https://t.co/ndusoK0f6R — by @arjunpoudeltkp",en,"[{'screen_name': 'arjunpoudeltkp', 'name': 'arjun poudel', 'id': '86678613'}]",['https://tkpo.st/3sydx35'],[],0,2,9,[],[],https://twitter.com/kathmandupost/status/1384541959755235330,False,,0,,,,,,,,[],,,,
1384537344649437188,1384537344649437188,2021-04-20 21:45:01 +0545,2021-04-20,21:45:01,+0545,625760052,kathmandupost,The Kathmandu Post,,Poorly performing local governments may see federal grant slashed  The Ministry of Federal Affairs and General Administration has introduced a working procedure to evaluate performance of local governments.    https://t.co/mOQbrHbjVd — by @journoprithvi,en,"[{'screen_name': 'journoprithvi', 'name': 'prithvi shrestha', 'id': '1407144090'}]",['http://tkpo.st/3x2vJoW'],[],0,0,8,[],[],https://twitter.com/kathmandupost/status/1384537344649437188,False,,0,,,,,,,,[],,,,
